d6ccca6a-1922-4cde-b000-659478424aa2;"4";"Магический глаз [Arcane eye]";"4 круг, прорицание";"1 действие";"30 футов";"В, С, М";"Концентрация, вплоть до 1 часа";"(мех летучей мыши)Вы создаете невидимый магический глаз в пределах дистанции, который парит в воздухе на время длительности.<br>
Вы мысленно воспринимаете зрительную информацию с глаза, у которого обычное зрение и темное зрение в пределах 30 футов. Глаз смотрит во всех направлениях.<br>
Вы можете действием переместить глаз на 30 футов в любом направлении. Глаз может удаляться от вас на любое расстояние, но не может уходить на другие планы существования. Сплошные препятствия блокируют движение глаза, но он может проходить через отверстия диаметром в 1 дюйм (2,5 сантиметра).<br>";"изобретатель"
4e2cfa6f-e465-4696-9c19-2ff03fe33ccb;"2";"Магическое оружие [Magic weapon]";"2 круг, преобразование";"1 бонусное действие";"Касание";"В, С";"Концентрация, вплоть до 1 часа";"Вы касаетесь немагического оружия. Пока заклинание активно, это оружие становится магическим оружием с бонусом +1 к броскам атаки и урона.<br>
<b>На больших уровнях.</b> Если вы накладываете это заклинание, используя ячейку 4 уровня или выше, бонус увеличивается до +2. Если вы используете ячейку заклинания 6 уровня или выше, бонус увеличивается до +3.<br>";"изобретатель"
bb7d10c6-ead3-42cd-802c-243a85a749a3;"2";"Малое восстановление [Lesser restoration]";"2 круг, ограждение";"1 действие";"Касание";"В, С";"Мгновенная";"Вы касаетесь существа и можете окончить одну болезнь или одно состояние, в котором оно находится. Этим состоянием может быть глухота, отравление, паралич или слепота.<br>";"изобретатель"
20e2f780-521a-463e-a47d-4e40e87c00bd;"1";"Маскировка [Disguise self]";"1 круг, иллюзия";"1 действие";"На себя";"В, С";"1 час";"Вы заставляете себя — включая одежду, доспехи, оружие и прочее имущество — выглядеть иначе, пока заклинание не окончится, или пока вы не окончите его преждевременно, действием. Вы можете выглядеть на 1 фут (30 сантиметров) выше или ниже, а также стать худым, толстым или получить среднее телосложение. Вы не можете менять основу тела, поэтому у новой формы должен быть такой же набор конечностей. Во всем остальном характер иллюзии определяете вы.<br>
Изменения, вызванные этим заклинанием, не выдерживают проверку физическим исследованием. Например, если вы добавили к своему снаряжению шляпу, предметы будут проходить сквозь нее, и все, кто к ней прикоснутся, либо ничего не почувствуют, либо почувствуют вашу голову и волосы. Если вы становитесь худее, то рука того, кто к вам тянется, наткнется на вас на полпути, ещё в воздухе.<br>
Для обнаружения того, что вы замаскированы, существо должно действием обследовать вашу внешность и преуспеть в проверке Интеллекта (Расследование) против вашей Сл заклинаний.<br>";"изобретатель"
97ed59c8-d783-4e04-ae5e-be4b21873a0a;"3";"Мерцание [Blink]";"3 круг, преобразование";"1 действие";"На себя";"В, С";"1 минута";"Пока заклинание активно, бросайте к20 в конце каждого своего хода. Если выпадет «11» или выше, вы исчезаете на текущем плане существования и появляетесь на Эфирном Плане (заклинание проваливается, если вы уже находитесь на этом плане). В начале своего следующего хода, а также если заклинание окончится, когда вы будете на Эфирном Плане, вы возвращаетесь в свободное пространство на свой выбор, которое вы видите в пределах 10 футов от места, из которого вы исчезли. Если в пределах дистанции нет свободного пространства, вы появляетесь в ближайшем свободном пространстве (выбранном случайным образом, если есть несколько подходящих мест). Вы можете остановить заклинание действием.<br>
Находясь на Эфирном Плане, вы можете видеть и слышать на плане, с которого пришли, видя все в оттенках серого и не видя того, что происходит за пределами 60 футов. Вы можете воздействовать только на существ, находящихся на Эфирном Плане, и только такие существа могут воздействовать на вас. Существа, не находящиеся там, не могут вас воспринимать и взаимодействовать с вами, если у них нет таких возможностей.<br>";"изобретатель"
249bc965-1dc4-40ed-a7ce-2b97158f5cff;"2";"Небесные письмена [Skywrite]";"2 круг, преобразование (ритуал)";"1 действие";"В пределах видимости";"В, С";"Концентрация, вплоть до 1 часа";"В указанной вами части неба, которую вы можете видеть, возникает до десяти слов. Слова выглядят так, словно состоят из облаков, и остаются на одном месте, пока действует заклинание, после чего рассеиваются. Сильный ветер может рассеять их и досрочно закончить заклинание.<br>";"изобретатель(XGE)"
95f9eb34-d19b-4fd0-9037-2f1894063425;"2";"Невидимость [Invisibility]";"2 круг, иллюзия";"1 действие";"Касание";"В, С, М";"Концентрация, вплоть до 1 часа";"(ресница в смоле)Существо, которого вы касаетесь, становится невидимым до окончания действия заклинания. Все, что цель несет или носит, становится невидимым, пока остается у неё. Заклинание оканчивается на цели, если она совершает атаку или накладывает заклинание.<br>
<b>На больших уровнях.</b> Если вы накладываете это заклинание, используя ячейку 3 уровня или выше, вы можете сделать целью одно дополнительное существо за каждый уровень ячейки выше второго.<br>";"изобретатель"
18e023c8-ae6c-407c-9647-69224090015c;"0";"Обморожение [Frostbite]";"Трюк, воплощение";"1 действие";"60 футов";"В, С";"Мгновенная";"Сильный холод окружает одно существо, которое вы можете видеть в пределах дистанции. Цель должна совершить спасбросок Телосложения. При провале цель получает 1к6 урона холодом и совершает с помехой следующий бросок атаки оружием до конца своего следующего хода.<br>
Урон этого заклинания увеличивается на 1к6, когда вы достигаете 5 уровня (2к6), 11 уровня (3к6) и 17 уровня (4к6).<br>";"изобретатель(XGE)"
c8040d97-5dd1-40bd-8146-ed5f90200206;"1";"Обнаружение магии [Detect magic]";"1 круг, прорицание (ритуал)";"1 действие";"На себя";"В, С";"Концентрация, вплоть до 10 минут";"Пока заклинание активно, вы чувствуете присутствие магии в пределах 30 футов. Если вы почувствовали за счет этого заклинания присутствие магии, вы можете действием увидеть слабую ауру вокруг видимого существа или предмета, несущего на себе магию, а также узнать школу этой магии, если она есть.<br>
Заклинание проницает большую часть барьеров, но блокируется 1 футом камня, 1 дюймом обычного металла, тонким листом свинца или 3 футами дерева или земли.<br>";"изобретатель"
2781a71f-5410-4550-8bde-ce1cde10cf3e;"0";"Огненный снаряд [Fire bolt]";"Трюк, воплощение";"1 действие";"120 футов";"В, С";"Мгновенная";"Вы кидаете сгусток огня в существо или предмет в пределах дистанции. Совершите по цели дальнобойную атаку заклинанием. При попадании цель получает урон огнём 1к10. Горючие предметы, по которым попало это заклинание, воспламеняются, если их никто не несет и не носит.<br>
Урон этого заклинания увеличивается на 1к10, когда вы достигаете 5 уровня (2к10), 11 уровня (3к10), 17 уровня (4к10).<br>";"изобретатель"
ba066fa5-fbeb-4aa0-9354-e51f100130c4;"1";"Огонь фей [Faerie fire]";"1 круг, воплощение";"1 действие";"60 футов";"В";"Концентрация, вплоть до 1 минуты";"Все предметы в кубе с длиной ребра 20 футов в пределах дистанции подсвечиваются синим, зелёным или фиолетовым цветом (на ваш выбор). Все существа в этой области тоже подсвечиваются, если проваливают спасбросок Ловкости. На время длительности заклинания подсвеченные предметы и существа испускают тусклый свет в радиусе 10 футов.<br>
Все броски атаки по затронутым существам и предметам совершаются с преимуществом, если атакующий видит их, и эти существа и предметы не получают преимуществ от невидимости.<br>";"изобретатель"
04f6095a-963f-42be-8595-59afb59f1fb0;"5";"Оживление вещей [Animate objects]";"5 круг, преобразование";"1 действие";"120 футов";"В, С";"Концентрация, вплоть до 1 минуты";"По вашему приказу оживают предметы. Выберите до десяти немагических предмета в пределах дистанции, которые никто не несёт и не носит. Цели Среднего размера считаются за два предмета, Большие цели считаются за четыре предмета, Огромные цели считаются за восемь предметов. Оживлять предметы с размером больше Огромного нельзя. Все цели оживают и становятся существами под вашим контролем до окончания действия заклинания или пока их хиты не уменьшатся до 0.<br>
Вы можете бонусным действием мысленно отдать приказ существу, созданному этим заклинанием, если оно находятся в пределах 500 футов от вас (если вы контролируете несколько существ, вы можете отдавать один и тот же приказ любому количеству из них одновременно). Вы решаете, какое действие совершит это существо, и куда оно переместится в следующем ходу, или вы можете отдать общий приказ, например, охранять комнату или коридор. Если вы не отдадите команду, существо будет всего лишь защищаться от врагов. Получив приказ, существо продолжает его выполнять, пока задача не будет выполнена.<br>

Оживлённый предмет является конструктом с КД, хитами, атаками, Силой и Ловкостью, зависящими от его размера. Его Телосложение 10, Интеллект и Мудрость 3, а Харизма 1. Его скорость 30 футов";"изобретатель"
6d44f2f2-e412-47ea-b6b5-1a4b5a42ec71;"1";"Опознание [Identify]";"1 круг, прорицание (ритуал)";"1 минута";"Касание";"В, С, М";"Мгновенная";"(жемчужина, стоящая как минимум 100 зм, и перо совы)Вы выбираете один предмет, не переставая касаться его во время всего накладывания заклинания. Если это магический предмет, вы узнаете его свойства, способ их использования, требуется ли для использования настройка на него, и сколько осталось зарядов, если они есть. Вы узнаете, действуют ли в данный момент заклинания на этот предмет, и что это за заклинания. Если предмет был создан заклинанием, вы узнаете, что это было за заклинание.<br>
Если вы вместо этого во время накладывания заклинания касаетесь существа, вы узнаете, какие заклинания в данный момент действуют на него.<br>";"изобретатель"
3b8db5ee-60a6-47ce-9ebe-ea90f38b0815;"4";"Отилюков упругий шар [Otiluke’s resilient sphere]";"4 круг, воплощение";"1 действие";"30 футов";"В, С, М";"Концентрация, вплоть до 1 минуты";"(полусферический кусочек чистого кристалла и такая же по размерам полусфера из гуммиарабика)Сфера из мерцающей силы окружает находящееся в пределах дистанции существо или предмет с размером не больше Большого. Нежелающее существо должно совершить спасбросок Ловкости. При провале существо окружается сферой на время действия заклинания.<br>
Ничто — ни физические предметы, ни энергия, ни эффекты прочих заклинаний — не могут проходить через этот барьер, как внутрь, так и наружу, хотя существо в сфере может дышать нормально. Сфера обладает иммунитетом ко всем видам урона, и находящееся внутри существо или предмет не может получать урон от атак и эффектов, исходящих снаружи, но и находящееся в сфере существо не может причинить урон ничему, что находится снаружи.<br>
Сфера ничего не весит, и она достаточно велика, чтобы вместить существо или предмет. Окруженное существо может действием толкать стены сферы и таким образом перемещаться со скоростью, уменьшенной вдвое. Точно так же, сферу могут поднять и переносить другие существа.<br>
Заклинание распад [disintegrate], нацеленное на сферу, уничтожает её, не причиняя вреда тому, что находится внутри.<br>";"изобретатель"
d543aff1-9d84-4641-856d-15b4dceddeba;"3";"Охранные руны [Glyph of warding]";"3 круг, ограждение";"1 час";"Касание";"В, С, М";"Пока не рассеется или не сработает";"(благовония и растолчённый бриллиант, стоящий как минимум 200 зм, расходуемый заклинанием)Когда вы накладываете это заклинание, вы рисуете руну, воздействующую на других существ, либо на поверхности (такой как стол или часть пола или стены) либо в предмете, который можно закрыть (книга, свиток или сундук с сокровищами), спрятав, таким образом, руну. Руна может покрывать площадь диаметром не больше 10 футов. Если предмет или поверхность переместят более чем на 10 футов от того места, где вы накладываете заклинание, руна сломается, и заклинание окончится, не срабатывая.<br>
Руна практически невидимая, и для её обнаружения требуется успешная проверка Интеллекта (Расследование) против Сл ваших заклинаний.<br>
Вы решаете, что вызовет срабатывание руны, когда накладываете заклинание. Руны, написанные на поверхности, обычно срабатывают от касания, вставания на нее, снимания предмета, стоящего на руне, приближения на определенное расстояние, или манипулирования предметом, на котором начертана руна. Для рун, начертанных внутри предметов, чаще всего выбирают открывание, приближение на определенное расстояние, взгляд, брошенный на руну или попытку её прочтения. После того как руна сработает, заклинание оканчивается.<br>
Вы можете внести уточнения, чтобы заклинание срабатывало только в определенных обстоятельствах или при соблюдении внешних признаков (таких как рост и вес), вид существа (например, руна может защищать только от аберраций и дроу), или мировоззрение. Вы можете также определить условия, при которых существо не будет активировать руну, например, произношение пароля.<br>
Когда вы наносите руну, выберите взрывную руну или заклинательную руну.<br>
<b>Взрывная руна</b>. Когда эта руна срабатывает, она испускает магическую энергию сферой с радиусом 20 футов с центром на руне. Эта сфера огибает углы. Все существа в этой области должны совершить спасбросок Ловкости. Существо получает урон звуком, кислотой, огнём, холодом или электричеством 5к8 при провале (вид урона вы выбираете при начертании руны), или половину этого урона при успехе.<br>
<b>Заклинательная руна</b>. Вы можете сохранить подготовленное заклинание с уровнем не выше 3 в руне, наложив его частью начертания руны. Заклинание должно нацеливаться на одно существо или область. При этом заклинание временно не вступает в силу. Когда руна срабатывает, хранящееся заклинание активируется. Если у заклинания есть цель, целью становится существо, вызвавшее срабатывание руны. Если заклинание действует на область, центр этой области будет на этом существе. Если заклинание призывает враждебных существ или создает вредоносные предметы или ловушки, они появляются как можно ближе к нарушителю и атакуют его. Если заклинание требует концентрации, оно длится до конца своей максимальной длительности.<br>
<b>На больших уровнях.</b> Если вы накладываете это заклинание, используя ячейку 4 уровня или выше, урон от взрывной руны увеличивается на 1к8 за каждый уровень ячейки выше третьего. Если вы накладывали заклинательную руну, вы можете хранить в ней заклинание с уровнем, равным уровню ячейки, использованной для охранных рун.<br>";"изобретатель"
b6dc6834-303b-454a-b141-b4ec3d2e05e3;"1";"Очищение пищи и питья [Purify food and drink]";"1 круг, преобразование (ритуал)";"1 действие";"10 футов";"В, С";"Мгновенная";"Вся немагическая еда и питьё в пределах сферы с радиусом 5 футов с центром на точке, выбранной вами в пределах дистанции, очищается и избавляется от ядов и болезней.<br>";"изобретатель"
